id,name,ruby
14874,使い捨て学習装置,つかいすてらーにんぐましん
14875,九字切りの呪符,くじきりのじゅふ
14876,ライトニング・ストーム,らいとにんぐすとーむ
14877,脆刃の剣,もろはのつるぎ
14878,Aiシャドー,あいしゃどー
14879,戦華史略－長坂之雄,せんかしりゃくちょうはんのゆう
14880,メガリス・プロモーション,めがりすぷろもーしょん
14881,メガリス・エマージョン,めがりすえまーじょん
14882,借カラクリ旅籠蔵,かりからくりはたごくら
14883,リサーガム・エクシーズ,りさーがむえくしーず
14884,クロノダイバー・レトログラード,くろのだいばーれとろぐらーど
14885,キャッチ・コピー,きゃっちこぴー
14886,アームズ・コール,あーむずこーる
14887,相視相殺,そうしそうさい
14888,幻魔の肖像,でびるずぽーとれいと
14889,ヘッド・ジャッジング,へっどじゃっじんぐ
14891,モンスターエクスプレス,もんすたーえくすぷれす
14892,泥岩の霊長－マンドストロング,でいがんのれいちょうまんどすとろんぐ
14893,砂漠の飛蝗賊,でざーとろーかすと
14894,タイラント・プランテーション,たいらんとぷらんてーしょん
14895,獣烈な争い,しれつなあらそい
14896,夢魔鏡の聖獣－パンタス,ゆめまきょうのせいじゅうぱんたす
14897,夢魔鏡の魔獣－パンタス,ゆめまきょうのまじゅうぱんたす
14898,夢魔鏡の天魔－ネイロス,ゆめまきょうのてんまねいろす
14899,夢幻の夢魔鏡,ゆめまぼろしのゆめまきょう
14900,混沌の夢魔鏡,こんとんのゆめまきょう
14901,夢現の夢魔鏡,ゆめうつつのゆめまきょう
14902,夢魔鏡の夢占い,ゆめまきょうのゆめうらない
14903,ワルキューレ・シグルーン,わるきゅーれしぐるーん
14904,リングリボー,りんぐりぼー
14905,超魔導師－ブラック・マジシャンズ,ちょうまどうしぶらっくまじしゃんず
14906,マジシャンズ・ソウルズ,まじしゃんずそうるず
14907,魂のしもべ,たましいのしもべ
14908,黒魔術の秘儀,くろまじゅつのひぎ
14909,マジシャンズ・コンビネーション,まじしゃんずこんびねーしょん
14910,E・HERO サンライザー,えれめんたるひーろーさんらいざー
14911,E・HERO リキッドマン,えれめんたるひーろーりきっどまん
14912,ジェネレーション・ネクスト,じぇねれーしょんねくすと
14913,フェイバリット・ヒーロー,ふぇいばりっとひーろー
14914,マジスタリー・アルケミスト,まじすたりーあるけみすと
14915,サテライト・ウォリアー,さてらいとうぉりあー
14916,ジャンク・コンバーター,じゃんくこんばーたー
14917,サテライト・シンクロン,さてらいとしんくろん
14918,シンクロ・チェイス,しんくろちぇいす
14919,くず鉄のシグナル,くずてつのしぐなる
14920,ガガガガマジシャン,ががががまじしゃん
14921,ズバババンチョー－GC,ずばばばんちょーがががこーと
14922,ドドドドワーフ－GG,どどどどわーふごごごぐろーぶ
14923,オノマト選択,おのまとぴっく
14924,フューチャー・ドライブ,ふゅーちゃーどらいぶ
14925,EM天空の魔術師,えんためいとてんくうのまじゅつし
14926,オッドアイズ・ウィザード・ドラゴン,おっどあいずうぃざーどどらごん
14927,EMポップアップ,えんためいとぽっぷあっぷ
14928,スマイル・アクション,すまいるあくしょん
14929,ペンデュラム・ディメンション,ぺんでゅらむでぃめんしょん
14930,L・G・D,りんくごっどどらごん
14931,破壊剣士の守護絆竜,はかいけんしのしゅごばんりゅう
14932,ユニオン・キャリアー,ゆにおんきゃりあー
14933,古代の機械弩士,あんてぃーくぎあばりすてぃっくしゅーたー
14934,虚光の宣告者,みらーじゅでくれあらー
14935,王神鳥シムルグ,おうしんちょうしむるぐ
14936,X・HERO ヘル・デバイサー,えくすとらひーろーへるでばいさー
14937,神聖魔皇后セレーネ,しんせいまこうごうせれーね
14938,クロスローズ・ドラゴン,くろすろーずどらごん
14939,レプティレス・エキドゥーナ,れぷてぃれすえきどぅーな
14940,幻獣機アウローラドン,げんじゅうきあうろーらどん
14941,武神姫－アハシマ,ぶじんきあはしま
14942,アーティファクト－ダグザ,あーてぃふぁくとだぐざ
14943,幻奏の華楽聖ブルーム・ハーモニスト,げんそうのはながくせいぶるーむはーもにすと
14944,捕食植物ヴェルテ・アナコンダ,ぷれでたーぷらんつゔぇるてあなこんだ
14945,魔界劇団－ハイパー・ディレクター,まかいげきだんはいぱーでぃれくたー
14946,星鍵士リイヴ,せいけんしりいゔ
14947,閃刀姫－ジーク,せんとうきじーく
14948,零氷の魔妖－雪女,れいひょうのまやかしゆきおんな
14949,天威龍－サハスラーラ,てんいりゅうさはすらーら
14950,始原竜プライマル・ドラゴン,しげんりゅうぷらいまるどらごん
14952,超魔導竜騎士－ドラグーン・オブ・レッドアイズ,ちょうまどうりゅうきしどらぐーんおぶれっどあいず
14953,深淵の青眼龍,でぃーぷおぶぶるーあいず
14954,E・HERO ネオス・クルーガー,えれめんたるひーろーねおすくるーがー
14955,究極宝玉獣 レインボー・ドラゴン,きゅうきょくほうぎょくじゅうれいんぼーどらごん
14956,シューティング・スター・ドラゴン・TG－EX,しゅーてぃんぐすたーどらごんてっくじーなすえくすぱんしょん
14957,スカーレッド・スーパーノヴァ・ドラゴン,すかーれっどすーぱーのゔぁどらごん
14958,FNo.0 未来龍皇ホープ,ふゅーちゃーなんばーずぜろみらいりゅうおうほーぷ
14959,銀河眼の残光竜,ぎゃらくしーあいずあふたーぐろうどらごん
14960,覇王黒竜オッドアイズ・リベリオン・ドラゴン－オーバーロード,はおうこくりゅうおっどあいずりべりおんどらごんおーばーろーど
14961,DDD死謳王バイス・レクイエム,でぃーでぃーでぃーしおうおうばいすれくいえむ
14962,デコード・トーカー・ヒートソウル,でこーどとーかーひーとそうる
14963,ヴァレルエンド・ドラゴン,ゔぁれるえんどどらごん
14964,聖なる影 ケイウス,かどしゃどーるけいうす
14965,影霊の翼 ウェンディ,りーしゃどーるうぇんでぃ
14966,影依の巫女 エリアル,のぇるしゃどーるえりある
14967,影光の聖選士,れーしゃどーるいんかーねーしょん
14968,エルシャドール・アプカローネ,えるしゃどーるあぷかろーね
14969,風霊媒師ウィン,ふうれいばいしうぃん
14970,オルターガイスト・メモリーガント,おるたーがいすとめもりーがんと
14971,オルターガイスト・プークエリ,おるたーがいすとぷーくえり
14972,オルターガイスト・フィジアラート,おるたーがいすとふぃじあらーと
14973,ティンダングル・ドールス,てぃんだんぐるどーるす
14974,ローズ・プリンセス,ろーずぷりんせす
14975,変容王 ヘル・ゲル,へんようおうへるげる
14976,ライトハンド・シャーク,らいとはんどしゃーく
14977,レフトハンド・シャーク,れふとはんどしゃーく
14978,白薔薇の回廊,ほわいとろーずくろいすたー
14979,バーニング・ソウル,ばーにんぐそうる
14980,報復の隠し歯,ほうふくのかくしば
14981,ハイパー・ギャラクシー,はいぱーぎゃらくしー
14982,ペンデュラム・シフト,ぺんでゅらむしふと
14983,ペンデュラム・エクシーズ,ぺんでゅらむえくしーず
14984,ダウジング・フュージョン,だうじんぐふゅーじょん
14985,白の水鏡,ほわいとみらー
14986,エターナル・ボンド,えたーなるぼんど
14987,パラレルエクシード,ぱられるえくしーど
14988,コードブレイカー・ゼロデイ,こーどぶれいかーぜろでい
14989,転生炎獣ゼブロイドX,さらまんぐれいとぜぶろいどえっくす
14990,剛鬼アイアン・クロー,ごうきあいあんくろー
14991,剛鬼ガッツ,ごうきがっつ
14992,海晶乙女バシランリマ,まりんせすばしらんりま
14993,ノクトビジョン・ドラゴン,のくとびじょんどらごん
14994,アークネメシス・プロートス,あーくねめしすぷろーとす
14995,アークネメシス・エスカトス,あーくねめしすえすかとす
14996,ネメシス・フラッグ,ねめしすふらっぐ
14997,ネメシス・アンブレラ,ねめしすあんぶれら
14998,ネメシス・コリドー,ねめしすこりどー
14999,深海のアーチザン,しんかいのあーちざん
15000,深海のセントリー,しんかいのせんとりー
15001,深海のミンストレル,しんかいのみんすとれる
15002,スカーレッド・ファミリア,すかーれっどふぁみりあ
15003,クリムゾン・リゾネーター,くりむぞんりぞねーたー
15004,ランタン・シャーク,らんたんしゃーく
15005,カッター・シャーク,かったーしゃーく
15006,戦華の孟－曹徳,せんかのもうそうとく
15007,戦華の来－張遠,せんかのらいちょうえん
15008,戦華の詭－賈文,せんかのきかぶん
15009,戦華の智－諸葛孔,せんかのちしょかつこう
15010,宵星の騎士ギルス,じゃっくないつおるふぇごーるぎるす
15011,天雷震龍－サンダー・ドラゴン,てんらいしんりゅうさんだーどらごん
15012,ドラゴンメイド・チェイム,どらごんめいどちぇいむ
15013,轟の王 ハール,とどろきのじぇねれいどはーる
15014,王の影 ロプトル,じぇねれいどしゃどうろぷとる
15015,破械童子サラマ,はかいどうじさらま
15016,獣神王バルバロス,じゅうしんおうばるばろす
15017,機巧狐－宇迦之御魂稲荷,きこうこうかのみたまのいなり
15018,トリアス・ヒエラルキア,とりあすひえらるきあ
15019,氷天禍チルブレイン,ひょうてんかちるぶれいん
15020,ユニオン・ドライバー,ゆにおんどらいばー
15021,悪魔嬢マリス,あくまじょうまりす
15022,朔夜しぐれ,さよしぐれ
15023,珠玉獣－アルゴザウルス,しゅぎょくじゅうあるござうるす
15024,百景戦都ゴルディロックス,らんどすけーぱーごるでぃろっくす
15025,マジカル・ハウンド,まじかるはうんど
15026,召喚獣アウゴエイデス,しょうかんじゅうあうごえいです
15027,ドラゴンメイド・シュトラール,どらごんめいどしゅとらーる
15028,深海姫プリマドーナ,しんかいひぷりまどーな
15029,飢鰐竜アーケティス,きがくりゅうあーけてぃす
15030,ヴァリアント・シャーク・ランサー,ゔぁりあんとしゃーくらんさー
15031,アロメルスの蟲惑魔,あろめるすのこわくま
15032,アクセスコード・トーカー,あくせすこーどとーかー
15033,プロキシー・F・マジシャン,ぷろきしーえふまじしゃん
15034,スプラッシュ・メイジ,すぷらっしゅめいじ
15035,リンクロス,りんくろす
15036,ジ・アライバル・サイバース＠イグニスター,じあらいばるさいばーすあっといぐにすたー
15037,コードブレイカー・ウイルスバーサーカー,こーどぶれいかーういるすばーさーかー
15038,コードブレイカー・ウイルスソードマン,こーどぶれいかーういるすそーどまん
15039,剛鬼ザ・パワーロード・オーガ,ごうきざぱわーろーどおーが
15040,海晶乙女グレート・バブル・リーフ,まりんせすぐれーとばぶるりーふ
15041,清冽の水霊使いエリア,せいれつのすいれいつかいえりあ
15042,Ai－コンタクト,あいこんたくと
15043,逆巻く炎の宝札,ばーにんぐどろー
15044,リンク・バースト,りんくばーすと
15045,メールの階段,めーるのかいだん
15046,星義の執行者,ねめしすあどらすてあ
15047,深海のアリア,しんかいのありあ
15048,コマンド・リゾネーター,こまんどりぞねーたー
15049,エアー・トルピード,えあーとるぴーど
15050,マドルチェ・サロン,まどるちぇさろん
15051,煉獄の災天,れんごくのさいてん
15052,超重機回送,へびーふぉわーど
15053,ウィッチクラフト・デモンストレーション,うぃっちくらふとでもんすとれーしょん
15054,眷現の呪眼,けんげんのじゅがん
15055,戦華史略－十万之矢,せんかしりゃくじゅうまんのや
15056,メガリス・アンフォームド,めがりすあんふぉーむど
15057,融合派兵,ゆうごうはへい
15058,繁華の花笑み,はんかのはなえみ
15059,Ai－Q,あいきゅー
15060,スカーレッド・レイン,すかーれっどれいん
15061,エクシーズ・リバイブ・スプラッシュ,えくしーずりばいぶすぷらっしゅ
15062,マドルチェ・プロムナード,まどるちぇぷろむなーど
15063,ウィッチクラフト・パトローナス,うぃっちくらふとぱとろーなす
15064,墓穴ホール,ぼけつほーる
15065,巨神封じの矢,てぃたのさいだー
15066,ピンポイント奪取,ぴんぽいんとだっしゅ
15070,ディザスター・デーモン,でぃざすたーでーもん
15071,背護衛,はいごえい
15072,いたずら風のフィードラン,いたずらかぜのふぃーどらん
15073,九魂猫,ないんらいぶずきゃっと
15074,契約の遂行,けいやくのすいこう
15075,海造賊－白髭の機関士,ぷらんどろーるしろひげのきかんし
15076,海造賊－赤髭の航海士,ぷらんどろーるあかひげのこうかいし
15077,海造賊－豪速のブレンネ号,ぷらんどろーるごうそくのぶれんねごう
15078,海造賊－静寂のメルケ号,ぷらんどろーるせいじゃくのめるけごう
15079,海造賊－キャプテン黒髭,ぷらんどろーるきゃぷてんくろひげ
15080,海造賊－拠点,ぷらんどろーるしっぷやーど
15081,海造賊－大航海,ぷらんどろーるぐらんどゔぉやーじゅ
15082,焔聖騎士－リナルド,えんせいきしりなるど
15083,宣告者の神巫,でくれあらーでぃゔぁいなー
15084,眩月龍セレグレア,げんげつりゅうせれぐれあ
15085,生きる偲びのシルキィ,いきるしのびのしるきぃ
15086,驀進装甲ライノセイバー,ばくしんそうこうらいのせいばー
15087,闇味鍋パーティー,やみなべぱーてぃー
15088,捲怒重来,けんどちょうらい
15089,マシンナーズ・カーネル,ましんなーずかーねる
15090,マシンナーズ・エアレイダー,ましんなーずえあれいだー
15091,マシンナーズ・ラディエーター,ましんなーずらでぃえーたー
15092,機甲部隊の再編制,ましんなーずりふぉーめーしょん
15093,機甲部隊の防衛圏,ましんなーずでぃふぇんすりじょん
15094,機甲部隊の超臨界,ましんなーずおーばーどらいぶ
15095,マシンナーズ・パゼストレージ,ましんなーずぱぜすとれーじ
15096,無許可の再奇動,めいるふぁくたーずこまんど
15097,魔救の追求者,あだましあしーかー
15098,魔救の探索者,あだましありさーちゃー
15099,魔救の分析者,あだましああならいざー
15100,魔救の奇石－レオナイト,あだましあくりすたれおないと
15101,魔救の奇石－ラプタイト,あだましあくりすたらぷたいと
15102,魔救の奇石－ドラガイト,あだましあくりすたどらがいと
15103,魔救の奇跡－レオナイト,あだましあらいずれおないと
15104,魔救の奇跡－ラプタイト,あだましあらいずらぷたいと
15105,魔救の奇跡－ドラガイト,あだましあらいずどらがいと
15106,アダマシア・ラピュタイト,あだましあらぴゅたいと
15107,魔救の息吹,あだましあさいん
15108,魔救の救砕,あだましありりーぶ
15109,魔救共振撃,あだましあれぞなんす
15110,六花のひとひら,りっかのひとひら
15111,六花精プリム,りっかせいぷりむ
15112,六花精シクラン,りっかせいしくらん
15113,六花精ボタン,りっかせいぼたん
15114,六花精エリカ,りっかせいえりか
15115,六花精スノードロップ,りっかせいすのーどろっぷ
15116,六花精ヘレボラス,りっかせいへれぼらす
15117,六花聖カンザシ,りっかせいかんざし
15118,六花聖ティアドロップ,りっかせいてぃあどろっぷ
15119,六花絢爛,りっかけんらん
15120,六花の風花,りっかのかざはな
15121,六花深々,りっかしんしん
15122,六花の薄氷,りっかのうすらい
15123,黄金卿エルドリッチ,おうごんきょうえるどりっち
15124,呪われしエルドランド,のろわれしえるどらんど
15125,黒き覚醒のエルドリクシル,くろきめざめのえるどりくしる
15126,白き宿命のエルドリクシル,しろきさだめのえるどりくしる
15127,紅き血染めのエルドリクシル,あかきちぞめのえるどりくしる
15128,黄金郷のガーディアン,おうごんきょうのがーでぃあん
15129,黄金郷のワッケーロ,おうごんきょうのわっけーろ
15130,黄金郷のコンキスタドール,おうごんきょうのこんきすたどーる
15131,永久に輝けし黄金郷,とわにかがやけしおうごんきょう
15132,黄金の征服王,えるどらどあでらんたーど
15133,アーマード・ビットロン,あーまーどびっとろん
15134,グッサリ＠イグニスター,ぐっさりあっといぐにすたー
15135,ガッチリ＠イグニスター,がっちりあっといぐにすたー
15136,幻魔皇ラビエル－天界蹂躙拳,げんまおうらびえるてんかいじゅうりんけん
15137,カオス・コア,かおすこあ
15138,暗黒の招来神,あんこくのしょうらいしん
15139,混沌の召喚神,こんとんのしょうかんしん
15140,失楽の霹靂,しつらくのへきれき
15141,七精の解門,しちせいのかいもん
15142,ハイパーブレイズ,はいぱーぶれいず
15143,覚醒の三幻魔,かくせいのさんげんま
15144,次元融合殺,じげんゆうごうさつ
15147,リセの蟲惑魔,りせのこわくま
15148,龍馬躓図,りゅうめつまずきのず
15149,魔妖遊行,まやかしゆうこう
15179,SRブロックンロール,すぴーどろいどぶろっくんろーる
15180,SRカールターボ,すぴーどろいどかーるたーぼ
15181,DDドッグ,でぃーでぃーどっぐ
15182,マシンナーズ・メタルクランチ,ましんなーずめたるくらんち
15232,電脳堺獣－鷲々,でんのうかいじゅうじゅじゅ
15233,電脳堺龍－龍々,でんのうかいりゅうろんろん
15234,電脳堺姫－娘々,でんのうかいきにゃんにゃん
15235,魔道騎士ガイア,まどうきしがいあ
15236,呪われし竜－カース・オブ・ドラゴン,のろわれしりゅうかーすおぶどらごん
15237,砲撃のカタパルト・タートル,ほうげきのかたぱるとたーとる
15238,暗黒騎士ガイアソルジャー,あんこくきしがいあそるじゃー
15239,教導の聖女エクレシア,どらぐまのせいじょえくれしあ
15240,教導の鉄槌テオ,どらぐまのてっついてお
15241,教導の天啓アディン,どらぐまのてんけいあでぃん
15242,教導の騎士フルルドリス,どらぐまのきしふるるどりす
15243,教導の大神祇官,まくしむすどらぐま
15244,教導枢機テトラドラグマ,きょうどうすうきてとらどらぐま
15245,アルバスの落胤,あるばすのらくいん
15246,焔聖騎士－アストルフォ,えんせいきしあすとるふぉ
15247,焔聖騎士－オジエ,えんせいきしおじえ
15248,焔聖騎士－オリヴィエ,えんせいきしおりゔぃえ
15249,焔聖騎士－モージ,えんせいきしもーじ
15250,メルフィー・ラビィ,めるふぃーらびぃ
15251,メルフィー・フェニィ,めるふぃーふぇにぃ
15252,メルフィー・キャシィ,めるふぃーきゃしぃ
15253,メルフィー・パピィ,めるふぃーぱぴぃ
15254,メルフィー・ポニィ,めるふぃーぽにぃ
15255,ファーニマル・ドルフィン,ふぁーにまるどるふぃん
15256,エッジインプ・サイズ,えっじいんぷさいず
15257,享楽の堕天使,きょうらくのだてんし
15258,悦楽の堕天使,えつらくのだてんし
15259,堕天使ネルガル,だてんしねるがる
15260,マシンナーズ・リザーブレイク,ましんなーずりざーぶれいく
15261,奇動装置メイルファクター,きどうそうちめいるふぁくたー
15262,斬機ダイア,ざんきだいあ
15263,ネメシス・キーストーン,ねめしすきーすとーん
15264,コアキメイル・サプライヤー,こあきめいるさぷらいやー
15265,サンダー・ハンド,さんだーはんど
15266,機巧辰－高闇御津羽靇,きこうしんたかくらみつはのおかみ
15267,揺海魚デッドリーフ,ようかいぎょでっどりーふ
15268,レッドポータン,れっどぽーたん
15269,龍狸燈,どらくーんらんぷ
15270,メガリス・フール,めがりすふーる
15271,竜魔道騎士ガイア,りゅうまどうきしがいあ
15272,灰燼竜バスタード,かいじんりゅうばすたーど
15273,デストーイ・クルーエル・ホエール,ですとーいくるーえるほえーる
15274,黎明の堕天使ルシフェル,れいめいのだてんしるしふぇる
15275,焔聖騎士導－ローラン,えんせいきしどうろーらん
15276,焔聖騎士帝－シャルル,えんせいきしていしゃるる
15277,混沌魔龍 カオス・ルーラー,こんとんまりゅうかおするーらー
15278,森のメルフィーズ,もりのめるふぃーず
15279,メルフィー・マミィ,めるふぃーまみぃ
15280,六花聖ストレナエ,りっかせいすとれなえ
15281,旋壊のヴェスペネイト,せんかいのゔぇすぺねいと
15282,戦華盟将－双龍,せんかめいしょうそうりゅう
15283,走破するガイア,そうはするがいあ
15284,螺旋融合,すぱいらるふゅーじょん
15285,教導国家ドラグマ,きょうどうこっかどらぐま
15286,天底の使徒,てんていのしと
15287,『焔聖剣－デュランダル』,えんせいけんでゅらんだる
15288,『焔聖剣－オートクレール』,えんせいけんおーとくれーる
15289,『焔聖剣－ジョワユーズ』,えんせいけんじょわゆーず
15290,メルフィーのおいかけっこ,めるふぃーのおいかけっこ
15291,メルフィーのかくれんぼ,めるふぃーのかくれんぼ
15292,デストーイ・リペアー,ですとーいりぺあー
15293,深海の都 マガラニカ,しんかいのみやこまがらにか
15294,戦華史略－東南之風,せんかしりゃくとうなんのかぜ
15295,魔救の奇縁,あだましあふれんず
15296,三戦の才,さんせんのさい
15297,ブリザード,ぶりざーど
15298,海竜神の激昂,りばいあさんのげきこう
15299,禁じられた一滴,きんじられたひとしずく
15300,天幻の龍輪,てんげんのりゅうりん
15301,賽挑戦,さいちょうせん
15302,螺旋砲撃,すぱいらるでぃすちゃーじ
15303,螺旋蘇生,すぱいらるりぼーん
15304,ドラグマ・パニッシュメント,どらぐまぱにっしゅめんと
15305,ドラグマ・エンカウンター,どらぐまえんかうんたー
15306,オリファンの角笛,おりふぁんのつのぶえ
15307,メルフィータイム,めるふぃーたいむ
15308,魔玩具厄瓶,ですとーいぽっと
15309,叛逆の堕天使,はんぎゃくのだてんし
15310,影依の偽典,しゃどーるーく
15311,ドラゴンメイドのお片付け,どらごんめいどのおかたづけ
15312,リターナブル瓶,りたーなぶるじゃー
15313,天龍雪獄,てんろうせつごく
15314,ジャンクスリープ,じゃんくすりーぷ
15315,海霊賊,ぱいれいつ
15316,バラガール,ばらがーる
15317,スクリプトン,すくりぷとん
15318,トウテツドラゴン,とうてつどらごん
15319,優麗なる霊鏡,ねくろいっぷぷりずむ
15320,海造賊－青髭の海技士,ぷらんどろーるあおひげのかいぎし
15321,海造賊－金髪の訓練生,ぷらんどろーるきんぱつのくんれんせい
15322,海造賊－双翼のリュース号,ぷらんどろーるそうよくのりゅーすごう
15323,海造賊－進水式,ぷらんどろーるせれもにー
