id,name,ruby
11585,ペンデュラム・ターン,ぺんでゅらむたーん
11586,召喚制限－エクストラネット,しょうかんせいげんえくすとらねっと
11587,EMコール,えんためいとこーる
11588,分断の壁,ぶんだんのかべ
11589,ドタキャン,どたきゃん
11590,RR－レディネス,れいどらぷたーずれでぃねす
11591,蒼焔の煉獄,そうえんのれんごく
11592,殻醒する煉獄,かくせいするれんごく
11593,機殻の再星,りくりふぉーと
11594,霊獣の騎襲,れいじゅうのきしゅう
11595,発条の巻き上げ,ぜんまいのまきあげ
11596,憑依解放,ひょういかいほう
11597,ブレイズ・キャノン・マガジン,ぶれいずきゃのんまがじん
11598,魂の転身,たましいのてんしん
11599,連成する振動,れんせいするしんどう
11600,姑息な落とし穴,こそくなおとしあな
11601,宝玉の先導者,ほうぎょくのせんどうしゃ
11602,宝玉の守護者,ほうぎょくのしゅごしゃ
11603,オーバー・ザ・レインボー,おーばーざれいんぼー
11604,宝玉の集結,ほうぎょくのしゅうけつ
11605,重機貨列車デリックレーン,じゅうきかれっしゃでりっくれーん
11606,No.81 超弩級砲塔列車スペリオル・ドーラ,なんばーずはちじゅういちちょうどきゅうほうとうれっしゃすぺりおるどーら
11607,転回操車,てんかいそうしゃ
11608,音響戦士ギータス,さうんどうぉりあーぎーたす
11609,音響戦士サイザス,さうんどうぉりあーさいざす
11610,アンプリファイヤー,あんぷりふぁいやー
11614,アルティマヤ・ツィオルキン,あるてぃまやつぃおるきん
11615,EMペンデュラム・マジシャン,えんためいとぺんでゅらむまじしゃん
11616,DDD壊薙王アビス・ラグナロク,でぃーでぃーでぃーかいちおうあびすらぐなろく
11617,デストーイ・シザー・タイガー,ですとーいしざーたいがー
11618,超重神鬼シュテンドウ－G,ちょうじゅうしんきしゅてんどうじー
11619,RR－フォース・ストリクス,れいどらぷたーずふぉーすすとりくす
11620,ジェット・シンクロン,じぇっとしんくろん
11621,ラッシュ・ウォリアー,らっしゅうぉりあー
11622,シンクロン・キャリアー,しんくろんきゃりあー
11623,スクラップ・フィスト,すくらっぷふぃすと
11624,リミットオーバー・ドライブ,りみっとおーばーどらいぶ
11625,スターライト・ジャンクション,すたーらいとじゃんくしょん
11626,くず鉄の像,くずてつのぞう
11627,スターダスト・ウォリアー,すたーだすとうぉりあー
11628,ジェット・ウォリアー,じぇっとうぉりあー
11629,アクセル・シンクロン,あくせるしんくろん
11630,ドラコニアの獣竜騎兵,どらこにあのじゅうりゅうきへい
11631,小人のいたずら,こびとのいたずら
11632,彼岸の悪鬼 ファーファレル,ひがんのあっきふぁーふぁれる
11633,彼岸の悪鬼 リビオッコ,ひがんのあっきりびおっこ
11634,彼岸の悪鬼 ハロウハウンド,ひがんのあっきはろうはうんど
11635,彼岸の鬼神 ヘルレイカー,ひがんのきしんへるれいかー
11636,善悪の彼岸,ぜんあくのひがん
11637,U.A.フィールドゼネラル,うるとらあすりーとふぃーるどぜねらる
11638,U.A.ストロングブロッカー,うるとらあすりーとすとろんぐぶろっかー
11639,U.A.ターンオーバー・タクティクス,うるとらあすりーとたーんおーばーたくてぃくす
11640,HSR魔剣ダーマ,はいすぴーどろいどまけんだーま
11641,ジャンク・ジャイアント,じゃんくじゃいあんと
11642,絶対王 バック・ジャック,ぜったいおうばっくじゃっく
11643,薔薇の聖騎士,ろーずぱらでぃん
11644,劫火の舟守 ゴースト・カロン,ごうかのふなもりごーすとかろん
11645,ペロペロケルペロス,ぺろぺろけるぺろす
11646,冥界騎士トリスタン,めいかいきしとりすたん
11647,冥界の麗人イゾルデ,めいかいのれいじんいぞるで
11648,M・HERO 闇鬼,ますくどひーろーあんき
11649,BF－星影のノートゥング,ぶらっくふぇざーほしかげののーとぅんぐ
11650,冥界濁龍 ドラゴキュートス,めいかいだくりゅうどらごきゅーとす
11651,No.95 ギャラクシーアイズ・ダークマター・ドラゴン,なんばーずきゅうじゅうごぎゃらくしーあいずだーくまたーどらごん
11652,キャット・シャーク,きゃっとしゃーく
11653,No.14 強欲のサラメーヤ,なんばーずじゅうよんごうよくのさらめーや
11654,No.21 氷結のレディ・ジャスティス,なんばーずにじゅういちひょうけつのれでぃじゃすてぃす
11655,パラレル・ツイスター,ぱられるついすたー
11656,星墜つる地に立つ閃珖,すたーだすとりすぱーく
11657,ハーピィ・ハーピスト,はーぴぃはーぴすと
11658,銅鑼ドラゴン,どらどらごん
11659,マンドラゴン,まんどらごん
11660,たつのこ,たつのこ
11661,プレゼント交換,ぷれぜんとこうかん
11662,仕込み爆弾,しこみばくだん
11664,魔サイの戦士,まさいのせんし
11665,キューブン,きゅーぶん
11666,にん人,にんじん
11667,古神ハストール,こしんはすとーる
11668,ロケットハンド,ろけっとはんど
11669,黒・魔・導・爆・裂・破,ぶらっくばーにんぐ
11670,黒・爆・裂・破・魔・導,ぶらっくばーにんぐまじっく
11671,ピースの輪,ぴーすのわ
11672,永遠の魂,えいえんのたましい
11673,スクランブル・エッグ,すくらんぶるえっぐ
11676,幻のグリフォン,まぼろしのぐりふぉん
11677,EMハンマーマンモ,えんためいとはんまーまんも
11678,EMガンバッター,えんためいとがんばったー
11679,EMリザードロー,えんためいとりざーどろー
11680,EMスプリングース,えんためいとすぷりんぐーす
11681,超重武者ビッグワラ－G,ちょうじゅうむしゃびっぐわらじー
11682,超重武者グロウ－V,ちょうじゅうむしゃぐろうぶ
11683,超重武者タマ－C,ちょうじゅうむしゃたましー
11684,超重武者装留バスター・ガントレット,ちょうじゅうむしゃそうるばすたーがんとれっと
11685,幻奏の歌姫ソプラノ,げんそうのうたひめそぷらの
11686,ファーニマル・シープ,ふぁーにまるしーぷ
11687,エッジインプ・ソウ,えっじいんぷそう
11688,エッジインプ・チェーン,えっじいんぷちぇーん
11689,エッジインプ・トマホーク,えっじいんぷとまほーく
11690,エッジインプ・DTモドキ,えっじいんぷでぃーてぃーもどき
11691,RR－インペイル・レイニアス,れいどらぷたーずいんぺいるれいにあす
11692,RR－ミミクリー・レイニアス,れいどらぷたーずみみくりーれいにあす
11693,妖仙獣 木魅,ようせんじゅうこだま
11694,妖仙獣 大幽谷響,ようせんじゅうおおやまびこ
11695,竜星因士－セフィラツバーン,いーさてらないとせふぃらつばーん
11696,覚星輝士－セフィラビュート,あすてらないとせふぃらびゅーと
11697,イェシャドール－セフィラナーガ,いぇしゃどーるせふぃらなーが
11698,オルシャドール－セフィラルーツ,おるしゃどーるせふぃらるーつ
11699,宝竜星－セフィラフウシ,ほうりゅうせいせふぃらふうし
11700,秘竜星－セフィラシウゴ,ひりゅうせいせふぃらしうご
11701,剣聖の影霊衣－セフィラセイバー,けんせいのねくろすせふぃらせいばー
11702,炎獣の影霊衣－セフィラエグザ,えんじゅうのねくろすせふぃらえぐざ
11703,英霊獣使い－セフィラムピリカ,えいれいじゅうつかいせふぃらむぴりか
11704,影霊獣使い－セフィラウェンディ,えいれいじゅうつかいせふぃらうぇんでぃ
11705,インフェルノイド・シャイターン,いんふぇるのいどしゃいたーん
11706,インフェルノイド・ベルフェゴル,いんふぇるのいどべるふぇごる
11707,インフェルノイド・リリス,いんふぇるのいどりりす
11708,幽鬼うさぎ,ゆきうさぎ
11709,マグマ・ドラゴン,まぐまどらごん
11710,ブンボーグ００４,ぶんぼーぐぜろぜろふぉー
11711,魔犬オクトロス,まけんおくとろす
11712,プリン隊,ぷりんたい
11713,sophiaの影霊衣,そぴあのねくろす
11714,幻奏の音姫マイスタリン・シューベルト,げんそうのおとひめまいすたりんしゅーべると
11715,幻奏の華歌聖ブルーム・ディーヴァ,げんそうのはなかせいぶるーむでぃーゔぁ
11716,デストーイ・ホイールソウ・ライオ,ですとーいほいーるそうらいお
11717,デストーイ・チェーン・シープ,ですとーいちぇーんしーぷ
11718,デストーイ・マッド・キマイラ,ですとーいまっどきまいら
11719,エルシャドール・アノマリリス,えるしゃどーるあのまりりす
11720,聖霊獣騎 ガイアペライオ,せいれいじゅうきがいあぺらいお
11721,クリアウィング・シンクロ・ドラゴン,くりあうぃんぐしんくろどらごん
11722,幻竜星－チョウホウ,げんりゅうせいちょうほう
11723,RR－ブレイズ・ファルコン,れいどらぷたーずぶれいずふぁるこん
11724,RR－レヴォリューション・ファルコン,れいどらぷたーずれゔぉりゅーしょんふぁるこん
11725,星守の騎士 プトレマイオス,てらないとぷとれまいおす
11726,マドルチェ・プディンセス・ショコ・ア・ラ・モード,まどるちぇぷでぃんせすしょこあらもーど
11727,EMキャスト・チェンジ,えんためいときゃすとちぇんじ
11728,融合徴兵,ゆうごうちょうへい
11729,デストーイ・ファクトリー,ですとーいふぁくとりー
11730,縫合蘇生,ほうごうそせい
11731,魔玩具融合,ですとーいふゅーじょん
11732,RUM－レヴォリューション・フォース,らんくあっぷまじっくれゔぉりゅーしょんふぉーす
11733,妖仙大旋風,ようせんだいせんぷう
11734,セフィラの輝跡,せふぃらのきせき
11735,セフィラの神託,せふぃらのしんたく
11736,煉獄の消華,れんごくのしょうか
11737,ギャラクシー・サイクロン,ぎゃらくしーさいくろん
11738,共鳴する振動,きょうめいするしんどう
11739,ペンデュラム・アライズ,ぺんでゅらむあらいず
11740,予想GUY,よそうがい
11741,EMピンチヘルパー,えんためいとぴんちへるぱー
11742,幻奏のイリュージョン,げんそうのいりゅーじょん
11743,ファーニマル・クレーン,ふぁーにまるくれーん
11744,デストーイ・カスタム,ですとーいかすたむ
11745,妖仙郷の眩暈風,ようせんきょうのめまいかぜ
11746,セフィラの聖選士,せふぃらのせいせんし
11747,セフィラの神撃,せふぃらのしんげき
11748,遡洸する煉獄,そこうするれんごく
11749,貪欲な瓶,どんよくなかめ
11750,一回休み,いっかいやすみ
11751,悪魔の嘆き,あくまのなげき
11752,深淵のスタングレイ,しんえんのすたんぐれい
11753,苦紋様の土像,くもんようのどぞう
11754,横取りボーン,よこどりぼーん
11755,再転,さいころ
11756,雷帝家臣ミスラ,らいていかしんみすら
11757,炎帝家臣ベルリネス,えんていかしんべるりねす
11758,地帝家臣ランドローブ,ちていかしんらんどろーぶ
11759,風帝家臣ガルーム,ふうていかしんがるーむ
11760,邪帝家臣ルキウス,じゃていかしんるきうす
11761,真帝王領域,しんていおうりょういき
11762,海皇子 ネプトアビス,かいおうじねぷとあびす
11763,炎王の孤島,えんおうのことう
11764,キメラテック・ランページ・ドラゴン,きめらてっくらんぺーじどらごん
11765,サイバー・ドラゴン・インフィニティ,さいばーどらごんいんふぃにてぃ
11766,SNo.39 希望皇ホープ・ザ・ライトニング,しゃいにんぐなんばーずさんじゅうきゅうきぼうおうほーぷざらいとにんぐ
11767,RR－トリビュート・レイニアス,れいどらぷたーずとりびゅーとれいにあす
11768,オッドアイズ・セイバー・ドラゴン,おっどあいずせいばーどらごん
11769,DDD覇龍王ペンドラゴン,でぃーでぃーでぃーはりゅうおうぺんどらごん
11770,ドラコニアの海竜騎兵,どらこにあのかいりゅうきへい
11771,月鏡の盾,つきがみのたて
11772,彼岸の悪鬼 ドラゴネル,ひがんのあっきどらごねる
11773,彼岸の悪鬼 バルバリッチャ,ひがんのあっきばるばりっちゃ
11774,彼岸の巡礼者 ダンテ,ひがんのじゅんれいしゃだんて
11775,旅人の結彼岸,たびびとのけつひがん
11776,U.A.ドレッドノートダンカー,うるとらあすりーとどれっどのーとだんかー
11777,U.A.コリバルリバウンダー,うるとらあすりーとこりばるりばうんだー
11778,U.A.フラッグシップ・ディール,うるとらあすりーとふらっぐしっぷでぃーる
11779,U.A.ペナルティ,うるとらあすりーとぺなるてぃ
11780,カイザー・シースネーク,かいざーしーすねーく
11781,ジャンク・ブレイカー,じゃんくぶれいかー
11784,慧眼の魔術師,けいがんのまじゅつし
11785,幻殻竜,げんかくりゅう
11786,召喚師ライズベルト,しょうかんしらいずべると
11787,相克の魔術師,そうこくのまじゅつし
11788,相生の魔術師,そうじょうのまじゅつし
11789,EMラクダウン,えんためいとらくだうん
11790,EMドラミング・コング,えんためいとどらみんぐこんぐ
11791,超重武者タイマ－２,ちょうじゅうむしゃたいまつー
11792,幻奏の音女オペラ,げんそうのおとめおぺら
11793,幻奏の音女タムタム,げんそうのおとめたむたむ
11794,ファーニマル・マウス,ふぁーにまるまうす
11795,DDパンドラ,でぃーでぃーぱんどら
11796,クリスタル・ローズ,くりすたるろーず
11797,RR－ファジー・レイニアス,れいどらぷたーずふぁじーれいにあす
11798,RR－シンギング・レイニアス,れいどらぷたーずしんぎんぐれいにあす
11799,Emダメージ・ジャグラー,えんためいじだめーじじゃぐらー
11800,Emフレイム・イーター,えんためいじふれいむいーたー
11801,Emハットトリッカー,えんためいじはっととりっかー
11802,Emトリック・クラウン,えんためいじとりっくくらうん
11803,Emスティルツ・シューター,えんためいじすてぃるつしゅーたー
11804,真紅眼の黒炎竜,れっどあいずぶらっくふれあどらごん
11805,伝説の黒石,ぶらっくおぶれじぇんど
11806,黒鋼竜,ぶらっくめたるどらごん
11807,真紅眼の凶雷皇－エビル・デーモン,れっどあいずらいとにんぐろーどえびるでーもん
11808,霊廟の守護者,れいびょうのしゅごしゃ
11809,竜剣士ラスターP,りゅうけんしらすたーぺんでゅらむ
11810,イグナイト・マグナム,いぐないとまぐなむ
11811,イグナイト・イーグル,いぐないといーぐる
11812,イグナイト・ドラグノフ,いぐないとどらぐのふ
11813,イグナイト・マスケット,いぐないとますけっと
11814,イグナイト・ライオット,いぐないとらいおっと
11815,イグナイト・キャリバー,いぐないときゃりばー
11816,イグナイト・アヴェンジャー,いぐないとあゔぇんじゃー
11817,イグナイト・スティンガー,いぐないとすてぃんがー
11818,アロマージ－ジャスミン,あろまーじじゃすみん
11819,アロマージ－カナンガ,あろまーじかなんが
11820,アロマージ－ローズマリー,あろまーじろーずまりー
11821,アロマージ－ベルガモット,あろまーじべるがもっと
11822,アロマポット,あろまぽっと
11823,インフェルノイド・デカトロン,いんふぇるのいどでかとろん
11824,獄落鳥,ごくらくちょう
11825,マジカル・アブダクター,まじかるあぶだくたー
11826,エキセントリック・デーモン,えきせんとりっくでーもん
11827,トゥーン・サイバー・ドラゴン,とぅーんさいばーどらごん
11828,ブンボーグ００５,ぶんぼーぐぜろぜろふぁいぶ
11829,応戦するG,おうせんするじー
11830,DDD神託王ダルク,でぃーでぃーでぃーしんたくおうだるく
11831,ジェムナイトレディ・ブリリアント・ダイヤ,じぇむないとれでぃぶりりあんとだいや
11832,悪魔竜ブラック・デーモンズ・ドラゴン,あくまりゅうぶらっくでーもんずどらごん
11833,インフェルノイド・ティエラ,いんふぇるのいどてぃえら
11834,爆竜剣士イグニスターP,ばくりゅうけんしいぐにすたーぷろみねんす
11835,覇王黒竜オッドアイズ・リベリオン・ドラゴン,はおうこくりゅうおっどあいずりべりおんどらごん
11836,DDD狙撃王テル,でぃーでぃーでぃーそげきおうてる
11837,Emトラピーズ・マジシャン,えんためいじとらぴーずまじしゃん
11838,真紅眼の鋼炎竜,れっどあいずふれあめたるどらごん
11839,ピアニッシモ,ぴあにっしも
11840,ブリリアント・フュージョン,ぶりりあんとふゅーじょん
11841,RUM－ラプターズ・フォース,らんくあっぷまじっくらぷたーずふぉーす
11842,バリア・バブル,ばりあばぶる
11843,真紅眼融合,れっどあいずふゅーじょん
11844,紅玉の宝札,こうぎょくのほうさつ
11845,イグニッションP,いぐにっしょんふぇにっくす
11846,アロマガーデン,あろまがーでん
11847,煉獄の虚夢,れんごくのきょむ
11848,一騎加勢,いっきかせい
11849,捕違い,とりちがい
11850,揺れる眼差し,ゆれるまなざし
11851,チキンレース,ちきんれーす
11852,ブリリアント・スパーク,ぶりりあんとすぱーく
11853,RR－リターン,れいどらぷたーずりたーん
11854,ラプターズ・ガスト,らぷたーずがすと
11855,トリック・ボックス,とりっくぼっくす
11856,真紅眼の鎧旋,りたーんおぶれっどあいず
11857,イグナイト・バースト,いぐないとばーすと
11858,潤いの風,うるおいのかぜ
11859,渇きの風,かわきのかぜ
11860,神風のバリア －エア・フォース－,しんぷうのばりあえあふぉーす
11861,イタチの大暴発,いたちのだいぼうはつ
11862,裁きの天秤,さばきのてんびん
11863,臨時収入,えくすとらばっく
11864,副作用？,ふくさよう
11865,矮星竜 プラネター,わいせいりゅうぷらねたー
11866,魔神アーク・マキナ,ましんあーくまきな
11867,ライトロード・セイント ミネルバ,らいとろーどせいんとみねるば
11868,ライトロードの裁き,らいとろーどのさばき
11869,ギアギアンカー,ぎあぎあんかー
11870,ギアギアチェンジ,ぎあぎあちぇんじ
11871,魔装戦士 ドラゴディウス,まそうせんしどらごでぃうす
11872,魔装戦士 ドラゴノックス,まそうせんしどらごのっくす
11873,魔装邪龍 イーサルウェポン,まそうじゃりゅういーさるうぇぽん
11874,召魔装着,しょうまそうちゃく
11875,犬タウルス,けんたうるす
11876,ダイナソーイング,だいなそーいんぐ
11877,タツノオトシオヤ,たつのおとしおや
11878,旧神ヌトス,きゅうしんぬとす
11879,幻夢境,どりーむらんど
11880,合神竜ティマイオス,がっしんりゅうてぃまいおす
11881,伝説の騎士 クリティウス,でんせつのきしくりてぃうす
11882,デス・ウイルス・ドラゴン,ですういるすどらごん
11883,タイラント・バースト・ドラゴン,たいらんとばーすとどらごん
11884,ミラーフォース・ドラゴン,みらーふぉーすどらごん
11885,クリティウスの牙,くりてぃうすのきば
11886,タイラント・ウィング,たいらんとうぃんぐ
11887,伝説の騎士 ヘルモス,でんせつのきしへるもす
11888,タイムマジック・ハンマー,たいむまじっくはんまー
11889,ロケット・ヘルモス・キャノン,ろけっとへるもすきゃのん
11890,女神の聖弓－アルテミス,めがみのせいきゅうあるてみす
11891,真紅眼の黒竜剣,れっどあいずぶらっくどらごんそーど
11892,ヘルモスの爪,へるもすのつめ
11893,ダブルマジックアームバインド,だぶるまじっくあーむばいんど
11894,ロード・オブ・ザ・レッド,ろーどおぶざれっど
11895,レッドアイズ・トランスマイグレーション,れっどあいずとらんすまいぐれーしょん
11896,黒竜の聖騎士,ないとおぶぶらっくどらごん
11897,黒竜降臨,こくりゅうこうりん
11898,レッドアイズ・スピリッツ,れっどあいずすぴりっつ
11899,レッドアイズ・バーン,れっどあいずばーん
11900,トゥーン・アンティーク・ギアゴーレム,とぅーんあんてぃーくぎあごーれむ
11901,トゥーン・キングダム,とぅーんきんぐだむ
11902,トゥーン・ロールバック,とぅーんろーるばっく
11903,シャドー・トゥーン,しゃどーとぅーん
11904,コミックハンド,こみっくはんど
11905,トゥーン・マスク,とぅーんますく
11906,トゥーンのかばん,とぅーんのかばん
11907,占術姫コインノーマ,せんじゅつきこいんのーま
11908,占術姫ペタルエルフ,せんじゅつきぺたるえるふ
11909,占術姫ウィジャモリガン,せんじゅつきうぃじゃもりがん
11910,占術姫アローシルフ,せんじゅつきあろーしるふ
11911,占術姫クリスタルウンディーネ,せんじゅつきくりすたるうんでぃーね
11912,聖占術姫タロットレイ,せいせんじゅつきたろっとれい
11913,聖占術の儀式,せいせんじゅつのぎしき
11914,黒猫の睨み,くろねこのにらみ
11915,リバース・リユース,りばーすりゆーす
11916,アクアアクトレス・テトラ,あくああくとれすてとら
11917,アクアアクトレス・グッピー,あくああくとれすぐっぴー
11918,アクアアクトレス・アロワナ,あくああくとれすあろわな
11919,水舞台,あくありうむすてーじ
11920,水舞台装置,あくありうむせっと
11921,水照明,あくありうむらいてぃんぐ
11922,水物語－ウラシマ,あくあすとーりーうらしま
11923,インフェルニティ・ビショップ,いんふぇるにてぃびしょっぷ
11924,ゴゴゴアリステラ＆デクシア,ごごごありすてらあんどでくしあ
11925,邪神官チラム・サバク,じゃしんかんちらむさばく
11926,ギャラクシー・ワーム,ぎゃらくしーわーむ
11927,ラーの翼神竜－球体形,らーのよくしんりゅうすふぃあもーど
11929,真紅眼の遡刻竜,れっどあいずとれーさーどらごん
11930,M・HERO ブラスト,ますくどひーろーぶらすと
11931,聖珖神竜 スターダスト・シフル,せいこうしんりゅうすたーだすとしふる
11932,SNo.0 ホープ・ゼアル,しゃいにんぐなんばーずぜろほーぷぜある
11933,法眼の魔術師,ほうがんのまじゅつし
11934,竜脈の魔術師,りゅうみゃくのまじゅつし
11935,竜穴の魔術師,りゅうけつのまじゅつし
11936,貴竜の魔術師,きりゅうのまじゅつし
11937,賤竜の魔術師,せんりゅうのまじゅつし
11938,EMドクロバット・ジョーカー,えんためいとどくろばっとじょーかー
11939,天空の虹彩,てんくうのこうさい
11940,ペンデュラム・コール,ぺんでゅらむこーる
11941,オッドアイズ・メテオバースト・ドラゴン,おっどあいずめておばーすとどらごん
11942,オッドアイズ・アブソリュート・ドラゴン,おっどあいずあぶそりゅーとどらごん
11943,絶望神アンチホープ,ぜつぼうしんあんちほーぷ
11944,真閃珖竜 スターダスト・クロニクル,しんせんこうりゅうすたーだすとくろにくる
11945,EMセカンドンキー,えんためいとせかんどんきー
11946,EMマンモスプラッシュ,えんためいとまんもすぷらっしゅ
11947,EMヘルプリンセス,えんためいとへるぷりんせす
11948,超重武者ヌス－１０,ちょうじゅうむしゃぬすとう
