id,name,ruby
7955,氷結界の交霊師,ひょうけっかいのこうれいし
7956,霞の谷の幼怪鳥,みすとばれーのようかいちょう
7957,霞の谷の執行者,みすとばれーのしっこうしゃ
7958,フレムベル・グルニカ,ふれむべるぐるにか
7959,フレムベル・ベビー,ふれむべるべびー
7960,A・マインド,あーりーまいんど
7961,A・O・J ブラインド・サッカー,あーりーおぶじゃすてぃすぶらいんどさっかー
7962,A・O・J リサーチャー,あーりーおぶじゃすてぃすりさーちゃー
7963,A・O・J エネミー・キャッチャー,あーりーおぶじゃすてぃすえねみーきゃっちゃー
7964,A・O・J サンダー・アーマー,あーりーおぶじゃすてぃすさんだーあーまー
7965,A・O・J コズミック・クローザー,あーりーおぶじゃすてぃすこずみっくくろーざー
7966,ワーム・リンクス,わーむりんくす
7967,ワーム・ミリディス,わーむみりでぃす
7968,ワーム・ノーブル,わーむのーぶる
7969,ナチュル・ビースト,なちゅるびーすと
7970,氷結界の虎王 ドゥローレン,ひょうけっかいのこおうどぅろーれん
7971,サーマル・ジェネクス,さーまるじぇねくす
7972,ジオ・ジェネクス,じおじぇねくす
7973,A・O・J フィールド・マーシャル,あーりーおぶじゃすてぃすふぃーるどまーしゃる
7978,創世竜,じぇねしっくどらごん
7981,星見獣ガリス,ほしみじゅうがりす
7982,真紅眼の飛竜,れっどあいずわいばーん
7983,ダークネス・デストロイヤー,だーくねすですとろいやー
7984,白夜の女王,ほわいとないつくぃーん
7985,マッシブ・ウォリアー,まっしぶうぉりあー
7986,チューニング・サポーター,ちゅーにんぐさぽーたー
7987,アームズ・エイド,あーむずえいど
7988,ギブ＆テイク,ぎぶあんどていく
7989,リミッター・ブレイク,りみったーぶれいく
7990,シールド・ウィング,しーるどうぃんぐ
7991,バイス・ドラゴン,ばいすどらごん
7992,"Tyr, the Vanquishing Warlord","Tyr,theVanquishingWarlord"
7993,"Lorelei, the Symphonic Arsenal","Lorelei,theSymphonicArsenal"
7998,サモン・リアクター・AI,さもんりあくたーえーあい
7999,ジャイアント・ボマー・エアレイド,じゃいあんとぼまーえあれいど
8000,トラップ・リアクター・RR,とらっぷりあくたーだぶるあーる
8001,ブラック・ボンバー,ぶらっくぼんばー
8002,マジック・リアクター・AID,まじっくりあくたーえいど
8003,ローズ・テンタクルス,ろーずてんたくるす
8004,ターレット・ウォリアー,たーれっとうぉりあー
8005,デブリ・ドラゴン,でぶりどらごん
8006,ハイパー・シンクロン,はいぱーしんくろん
8007,レッド・デーモンズ・ドラゴン／バスター,れっどでーもんずどらごんすらっしゅばすたー
8008,トラップ・イーター,とらっぷいーたー
8009,ツイン・ブレイカー,ついんぶれいかー
8010,ダーク・リペアラー,だーくりぺあらー
8011,BF－疾風のゲイル,ぶらっくふぇざーしっぷうのげいる
8012,BF－黒槍のブラスト,ぶらっくふぇざーくろやりのぶらすと
8013,BF－暁のシロッコ,ぶらっくふぇざーあかつきのしろっこ
8014,夜薔薇の騎士,ないとろーずないと
8015,D・ボードン,でぃふぉーまーぼーどん
8016,D・パッチン,でぃふぉーまーぱっちん
8017,デスカイザー・ドラゴン／バスター,ですかいざーどらごんすらっしゅばすたー
8018,ハイパーサイコガンナー／バスター,はいぱーさいこがんなーすらっしゅばすたー
8019,アーカナイト・マジシャン／バスター,あーかないとまじしゃんすらっしゅばすたー
8020,アーケイン・ファイロ,あーけいんふぁいろ
8021,バスター・マーセナリ,ばすたーまーせなり
8022,バスター・ビースト,ばすたーびーすと
8023,黒翼の魔術師,こくよくのまじゅつし
8024,ライフ・コーディネイター,らいふこーでぃねいたー
8025,剣闘獣サムニテ,ぐらでぃあるびーすとさむにて
8026,トマボー,とまぼー
8027,スキヤナー,すきやなー
8028,次元要塞兵器,じげんようさいへいき
8029,砂漠の守護者,でざーとがーどなー
8030,クロスソード・ハンター,くろすそーどはんたー
8031,ハチビー,はちびー
8032,トリプル・ヴァイパー,とりぷるゔぁいぱー
8033,エーリアン・リベンジャー,えーりあんりべんじゃー
8034,エーリアンモナイト,えーりあんもないと
8035,ダーク・ダイブ・ボンバー,だーくだいぶぼんばー
8036,BF－アーマード・ウィング,ぶらっくふぇざーあーまーどうぃんぐ
8037,ハイパーサイコガンナー,はいぱーさいこがんなー
8038,アーカナイト・マジシャン,あーかないとまじしゃん
8039,宇宙砦ゴルガー,そらとりでごるがー
8040,プリベント・スター,ぷりべんとすたー
8041,反目の従者,はんもくのじゅうしゃ
8042,スター・ブラスト,すたーぶらすと
8043,フェザー・ウィンド・アタック,ふぇざーうぃんどあたっく
8044,D・レトロエンジン,でぃふぉーまーれとろえんじん
8045,D・フィールド,でぃふぉーまーふぃーるど
8046,バスター・バースト,ばすたーばーすと
8047,バスター・テレポート,ばすたーてれぽーと
8048,Re－BUSTER,りばすたー
8049,サイコ・ソード,さいこそーど
8050,念動収集機,ねんどうしゅうしゅうき
8051,剣闘獣の底力,ぐらでぃあるびーすとのそこぢから
8052,種子弾丸,しゅしだんがん
8053,超栄養太陽,ちょうえいようたいよう
8054,六武ノ書,ろくぶのしょ
8055,大樹海,だいじゅかい
8056,魔法族の結界,まほうぞくのけっかい
8057,トライアングル・エリア,とらいあんぐるえりあ
8058,バスター・モード,ばすたーもーど
8059,スピリット・フォース,すぴりっとふぉーす
8060,ロスト・スター・ディセント,ろすとすたーでぃせんと
8061,白銀のバリア－シルバーフォース－,はくぎんのばりあしるばーふぉーす
8062,ハーフorストップ,はーふおあすとっぷ
8063,ナイトメア・デーモンズ,ないとめあでーもんず
8064,ブラック・アロー,ぶらっくあろー
8065,アイヴィ・シャックル,あいゔぃしゃっくる
8066,フェイク・エクスプロージョン・ペンタ,ふぇいくえくすぷろーじょんぺんた
8067,D・バリア,でぃふぉーまーばりあ
8068,ブレンD,ぶれんでぃふぉーまー
8069,バスター・スラッシュ,ばすたーすらっしゅ
8070,バスター・カウンター,ばすたーかうんたー
8071,サイコ・チューン,さいこちゅーん
8072,超能力治療,すーぱーなちゅらるひーりんぐ
8073,トロイの剣闘獣,とろいのぐらでぃあるびーすと
8074,棘の壁,そーんうぉーる
8075,惑星汚染ウイルス,わくせいおせんういるす
8076,ウィクトーリア,うぃくとーりあ
8077,復讐の女戦士ローズ,ふくしゅうのおんなせんしろーず
8078,シード・オブ・フレイム,しーどおぶふれいむ
8079,サボウ・ファイター,さぼうふぁいたー
8080,マックス・テレポーター,まっくすてれぽーたー
8081,RAI－JIN,らいじん
8082,RAI－MEI,らいめい
8083,剣闘獣レティアリィ,ぐらでぃあるびーすとれてぃありぃ
8084,ナイトエンド・ソーサラー,ないとえんどそーさらー
8085,マジックテンペスター,まじっくてんぺすたー
8086,狡猾な落とし穴,こうかつなおとしあな
8087,超魔神イド,ちょうまじんいど
8088,バイオレット・ウィッチ,ばいおれっとうぃっち
8089,トラゴエディア,とらごえでぃあ
8090,エンシェント・フェアリー・ドラゴン,えんしぇんとふぇありーどらごん
8091,スターダスト・ドラゴン／バスター,すたーだすとどらごんすらっしゅばすたー
8092,魔轟神ルリー,まごうしんるりー
8093,魔轟神グリムロ,まごうしんぐりむろ
8094,魔轟神ガルバス,まごうしんがるばす
8095,魔轟神クシャノ,まごうしんくしゃの
8096,ジュラック・プロトプス,じゅらっくぷろとぷす
8097,ジュラック・ヴェロー,じゅらっくゔぇろー
8098,ジュラック・モノロフ,じゅらっくものろふ
8099,ジュラック・ティラヌス,じゅらっくてぃらぬす
8100,ナチュル・アントジョー,なちゅるあんとじょー
8101,ナチュル・スパイダーファング,なちゅるすぱいだーふぁんぐ
8102,ナチュル・ローズウィップ,なちゅるろーずうぃっぷ
8103,ナチュル・コスモスビート,なちゅるこすもすびーと
8104,ジェネクス・ブラスト,じぇねくすぶらすと
8105,リサイクル・ジェネクス,りさいくるじぇねくす
8106,アーミー・ジェネクス,あーみーじぇねくす
8107,氷結界の修験者,ひょうけっかいのしゅげんじゃ
8108,氷結界の風水師,ひょうけっかいのふうすいし
8109,霞の谷のファルコン,みすとばれーのふぁるこん
8110,霞の谷の巨神鳥,みすとばれーのきょしんちょう
8111,A・O・J リバース・ブレイク,あーりーおぶじゃすてぃすりばーすぶれいく
8112,A・O・J アンリミッター,あーりーおぶじゃすてぃすあんりみったー
8113,ワーム・オペラ,わーむおぺら
8114,ワーム・プリンス,わーむぷりんす
8115,ワーム・クィーン,わーむくぃーん
8116,ワーム・ルクイエ,わーむるくいえ
8117,魔轟神ヴァルキュルス,まごうしんゔぁるきゅるす
8118,ジュラック・ギガノト,じゅらっくぎがのと
8119,ナチュル・ガオドレイク,なちゅるがおどれいく
8120,ウィンドファーム・ジェネクス,うぃんどふぁーむじぇねくす
8121,霞の谷の雷神鬼,みすとばれーのらいじんき
8122,E・HERO ガイア,えれめんたるひーろーがいあ
8126,E・HERO アイスエッジ,えれめんたるひーろーあいすえっじ
8129,E・HERO アブソルートZero,えれめんたるひーろーあぶそるーとぜろ
8132,神聖魔導王 エンディミオン,しんせいまどうおうえんでぃみおん
8133,聖なる解呪師,せいんとでぃすえんちゃんたー
8134,魔導騎士 ディフェンダー,まどうきしでぃふぇんだー
8135,魔法都市エンディミオン,まほうとしえんでぃみおん
8136,魔力掌握,まりょくしょうあく
8137,パワー・ツール・ドラゴン,ぱわーつーるどらごん
8138,ギガンテック・ファイター／バスター,ぎがんてっくふぁいたーすらっしゅばすたー
8139,ダーク・ボルテニス,だーくぼるてにす
8140,マテリアルファルコ,まてりあるふぁるこ
8141,ボーンクラッシャー,ぼーんくらっしゃー
8142,エーリアン・キッズ,えーりあんきっず
8143,ミンゲイドラゴン,みんげいどらごん
8144,竜宮の白タウナギ,りゅうぐうのしろたうなぎ
8145,未知ガエル,みちがえる
8146,古代遺跡コードA,こだいいせきこーどえー
8147,シンクロ・チェンジ,しんくろちぇんじ
8150,HEROの遺産,ひーろーのいさん
8154,ロックストーン・ウォリアー,ろっくすとーんうぉりあー
8155,レベル・ウォリアー,れべるうぉりあー
8156,ストロング・ウィンド・ドラゴン,すとろんぐうぃんどどらごん
8157,ダーク・ヴァージャー,だーくゔぁーじゃー
8158,フェニキシアン・シード,ふぇにきしあんしーど
8159,フェニキシアン・クラスター・アマリリス,ふぇにきしあんくらすたーあまりりす
8160,ガード・ヘッジ,がーどへっじ
8161,イービル・ソーン,いーびるそーん
8162,BF－極北のブリザード,ぶらっくふぇざーきょくほくのぶりざーど
8163,BF－蒼炎のシュラ,ぶらっくふぇざーそうえんのしゅら
8164,BF－月影のカルート,ぶらっくふぇざーげつえいのかるーと
8165,BF－漆黒のエルフェン,ぶらっくふぇざーしっこくのえるふぇん
8166,D・リモコン,でぃふぉーまーりもこん
8167,D・ビデオン,でぃふぉーまーびでおん
8168,D・スコープン,でぃふぉーまーすこーぷん
8169,ガジェット・アームズ,がじぇっとあーむず
8170,トラパート,とらぱーと
8171,地縛神 Aslla piscu,じばくしんあすらぴすく
8172,地縛神 Ccapac Apu,じばくしんこかぱくあぷ
8173,コアキメイル・ヴァラファール,こあきめいるゔぁらふぁーる
8174,コアキメイル・パワーハンド,こあきめいるぱわーはんど
8175,コアキメイル・ガーディアン,こあきめいるがーでぃあん
8176,コアキメイル・ドラゴ,こあきめいるどらご
8177,コアキメイル・アイス,こあきめいるあいす
8178,コアキメイル・デビル,こあきめいるでびる
8179,ゴーレム,ごーれむ
8180,ミノケンサテュロス,みのけんさてゅろす
8181,強化人類サイコ,きょうかじんるいさいこ
8182,マスター・ジーグ,ますたーじーぐ
8183,地獄からの使い,じごくからのつかい
8184,ギガストーン・オメガ,ぎがすとーんおめが
8185,エーリアン・ドッグ,えーりあんどっぐ
8186,ニードル・ギルマン,にーどるぎるまん
8187,深海のディーヴァ,しんかいのでぃーゔぁ
8188,シー・アーチャー,しーあーちゃー
8189,ラヴァ・ドラゴン,らゔぁどらごん
8190,竜の尖兵,りゅうのせんぺい
8191,G・B・ハンター,じーびーはんたー
8192,エクスプロード・ウィング・ドラゴン,えくすぷろーどうぃんぐどらごん
8193,BF－アームズ・ウィング,ぶらっくふぇざーあーむずうぃんぐ
8195,トライデント・ドラギオン,とらいでんとどらぎおん
8196,神海竜ギシルノドン,しんかいりゅうぎしるのどん
8197,ワン・フォー・ワン,わんふぉーわん
8198,トラスト・マインド,とらすとまいんど
8199,憎悪の棘,ぞうおのとげ
8200,マジック・プランター,まじっくぷらんたー
8201,ワンダー・クローバー,わんだーくろーばー
8202,アゲインスト・ウィンド,あげいんすとうぃんど
8203,黒い旋風,くろいせんぷう
8204,ジャンクBOX,じゃんくぼっくす
8205,ダブルツールD＆C,だぶるつーるでぃーあんどしー
8206,D・リペアユニット,でぃふぉーまーりぺあゆにっと
8207,コアキメイルの鋼核,こあきめいるのこうかく
8208,緊急鋼核処分,きんきゅうこうかくしょぶん
8209,緊急合成,きんきゅうごうせい
8210,サイコパス,さいこぱす
8211,ナチュラル・チューン,なちゅらるちゅーん
8212,至高の木の実,すぷれましーべりー
8213,禁じられた聖杯,きんじられたせいはい
8214,カーム・マジック,かーむまじっく
8215,奇跡の軌跡,みらくるるーかす
8216,クリムゾン・ヘルフレア,くりむぞんへるふれあ
8217,チューナー・キャプチャー,ちゅーなーきゃぷちゃー
8218,オーバー・デッド・ライン,おーばーでっどらいん
8219,ウィキッド・リボーン,うぃきっどりぼーん
8220,デルタ・クロウ－アンチ・リバース,でるたくろうあんちりばーす
8221,レベル・リチューナー,れべるりちゅーなー
8222,フェイク・フェザー,ふぇいくふぇざー
8223,トラップ・スタン,とらっぷすたん
8224,D・バインド,でぃふぉーまーばいんど
8225,レクリスパワー,れくりすぱわー
8226,オートマチック・レーザー,おーとまちっくれーざー
8227,窮鼠の進撃,きゅうそのしんげき
8228,無力の証明,むりょくのしょうめい
8229,ボーン・テンプル・ブロック,ぼーんてんぷるぶろっく
8230,超古代生物の墓場,ちょうこだいせいぶつのはかば
8231,ツバメ返し,つばめがえし
8232,呪言の鏡,じゅごんのかがみ
8233,魔轟神ウルストス,まごうしんうるすとす
8234,魔轟神クルス,まごうしんくるす
8235,魔轟神トピー,まごうしんとぴー
8236,魔轟神ソルキウス,まごうしんそるきうす
8237,魔轟神ミーズトージ,まごうしんみーずとーじ
8238,ジュラック・プティラ,じゅらっくぷてぃら
8239,ジュラック・イグアノン,じゅらっくいぐあのん
8240,ジュラック・ブラキス,じゅらっくぶらきす
8241,ジュラック・スピノス,じゅらっくすぴのす
8242,ナチュル・ドラゴンフライ,なちゅるどらごんふらい
8243,ナチュル・サンフラワー,なちゅるさんふらわー
8244,ナチュル・クリフ,なちゅるくりふ
8245,ナチュル・トライアンフ,なちゅるとらいあんふ
8246,レアル・ジェネクス・ターボ,れあるじぇねくすたーぼ
8247,レアル・ジェネクス・コーディネイター,れあるじぇねくすこーでぃねいたー
8248,レアル・ジェネクス・クラッシャー,れあるじぇねくすくらっしゃー
8249,レアル・ジェネクス・マグナ,れあるじぇねくすまぐな
8250,氷結界の決起隊,ひょうけっかいのけっきたい
8251,氷結界の武士,ひょうけっかいのもののふ
8252,氷結界の水影,ひょうけっかいのみずかげ
8253,氷結界の輸送部隊,ひょうけっかいのゆそうぶたい
8254,ワーム・ソリッド,わーむそりっど
8255,ワーム・テンタクルス,わーむてんたくるす
8256,ワーム・アグリィ,わーむあぐりぃ
8257,ワーム・ヴィクトリー,わーむゔぃくとりー
8258,魔轟神レヴュアタン,まごうしんれゔゅあたん
8259,ジュラック・ヴェルヒプト,じゅらっくゔぇるひぷと
8260,ナチュル・パルキオン,なちゅるぱるきおん
8261,レアル・ジェネクス・クロキシアン,れあるじぇねくすくろきしあん
8262,氷結界の龍 グングニール,ひょうけっかいのりゅうぐんぐにーる
8263,スノーマンイーター,すのーまんいーたー
8264,おジャマ・レッド,おじゃまれっど
8265,おジャマ・ブルー,おじゃまぶるー
8266,おジャマ・カントリー,おじゃまかんとりー
8267,柴戦士タロ,しばせんしたろ
8268,スピード・キング☆スカル・フレイム,すぴーどきんぐすかるふれいむ
8269,スカル・フレイム,すかるふれいむ
8270,バーニング・スカルヘッド,ばーにんぐすかるへっど
8271,スカル・コンダクター,すかるこんだくたー
8272,インフェルニティ・デーモン,いんふぇるにてぃでーもん
8273,インフェルニティ・ドワーフ,いんふぇるにてぃどわーふ
8274,インフェルニティ・ガーディアン,いんふぇるにてぃがーでぃあん
8275,インフェルニティ・デストロイヤー,いんふぇるにてぃですとろいやー
8276,コート・オブ・ジャスティス,こーとおぶじゃすてぃす
8280,パワード・チューナー,ぱわーどちゅーなー
8281,弱者の意地,じゃくしゃのいじ
8282,ガトムズの緊急指令,がとむずのきんきゅうしれい
8283,大天使クリスティア,だいてんしくりすてぃあ
8286,堕天使降臨,だてんしこうりん
8287,堕天使アスモディウス,だてんしあすもでぃうす
8288,堕天使スペルビア,だてんしすぺるびあ
8289,堕天使エデ・アーラエ,だてんしえであーらえ
8292,クリボン,くりぼん
8293,サニー・ピクシー,さにーぴくしー
8294,サンライト・ユニコーン,さんらいとゆにこーん
8295,BF－銀盾のミストラル,ぶらっくふぇざーぎんたてのみすとらる
8296,BF－大旆のヴァーユ,ぶらっくふぇざーたいはいのゔぁーゆ
8297,BF－鉄鎖のフェーン,ぶらっくふぇざーてっさのふぇーん
8298,D・マグネンI,でぃふぉーまーまぐねんあい
8299,ジェスター・ロード,じぇすたーろーど
8300,ジェスター・コンフィ,じぇすたーこんふぃ
8301,フォーチュンレディ・ライティー,ふぉーちゅんれでぃらいてぃー
8302,フォーチュンレディ・ファイリー,ふぉーちゅんれでぃふぁいりー
8303,インフェルニティ・ビースト,いんふぇるにてぃびーすと
8304,ダークシー・レスキュー,だーくしーれすきゅー
8305,ダークシー・フロート,だーくしーふろーと
8306,ワンショット・ロケット,わんしょっとろけっと
8307,地縛神 Cusillu,じばくしんくしる
8308,地縛神 Chacu Challhua,じばくしんちゃくちゃるあ
8309,コアキメイル・ロック,こあきめいるろっく
8310,コアキメイル・クルセイダー,こあきめいるくるせいだー
8311,コアキメイル・スピード,こあきめいるすぴーど
8312,コアキメイル・トルネード,こあきめいるとるねーど
8313,コアキメイル・フルバリア,こあきめいるふるばりあ
8314,スケイルモース,すけいるもーす
8315,黒光りするG,くろびかりするじー
8316,アームズ・シーハンター,あーむずしーはんたー
8317,神竜アクアバザル,しんりゅうあくあばざる
8318,フィッシュボーグ－ガンナー,ふぃっしゅぼーぐがんなー
8319,シャーク・ザ・クルー,しゃーくざくるー
8320,アーマード・サイキッカー,あーまーどさいきっかー
8321,ジェネティック・ウーマン,じぇねてぃっくうーまん
8322,マジキャット,まじきゃっと
8323,サイボーグドクター,さいぼーぐどくたー
8324,ホワイトポータン,ほわいとぽーたん
8325,マインフィールド,まいんふぃーるど
8326,XX－セイバー フォルトロール,だぶるえっくすせいばーふぉるとろーる
8327,XX－セイバー レイジグラ,だぶるえっくすせいばーれいじぐら
8328,フレムベル・ヘルドッグ,ふれむべるへるどっぐ
8329,エンシェント・クリムゾン・エイプ,えんしぇんとくりむぞんえいぷ
8330,ファルシオンβ,ふぁるしおんべーた
8331,ワンショット・キャノン,わんしょっときゃのん
8332,アンデット・スカル・デーモン,あんでっとすかるでーもん
8333,エンシェント・ホーリー・ワイバーン,えんしぇんとほーりーわいばーん
8334,XX－セイバー ガトムズ,だぶるえっくすせいばーがとむず
8335,拘束解放波,こうそくかいほうは
8336,白銀の翼,はくぎんのつばさ
8337,アドバンスドロー,あどばんすどろー
8338,古の森,いにしえのもり
8339,救急救命,きゅうきゅうきゅうめい
8340,スピリット・バーナー,すぴりっとばーなー
8341,フューチャー・ヴィジョン,ふゅーちゃーゔぃじょん
8342,コア濃度圧縮,こあのうどあっしゅく
8343,コアバスター,こあばすたー
8344,一族の結束,いちぞくのけっそく
8345,ハイドロプレッシャーカノン,はいどろぷれっしゃーかのん
8346,ウォーターハザード,うぉーたーはざーど
8347,脳開発研究所,のうかいはつけんきゅうじょ
8348,セイバー・スラッシュ,せいばーすらっしゅ
8349,剣の煌き,つるぎのきらめき
8350,真炎の爆発,しんえんのばくはつ
8351,エンシェント・リーフ,えんしぇんとりーふ
8352,化石調査,かせきちょうさ
8353,スキル・サクセサー,すきるさくせさー
8354,トゥルース・リインフォース,とぅるーすりいんふぉーす
8355,ガリトラップ－ピクシーの輪－,がりとらっぷぴくしーのわ
8356,妖精の風,ようせいのかぜ
8357,宮廷のしきたり,きゅうていのしきたり
8358,不協和音,ふきょうわおん
8359,フォーチュン・スリップ,ふぉーちゅんすりっぷ
8360,デプス・アミュレット,でぷすあみゅれっと
8361,ダメージ・トランスレーション,だめーじとらんすれーしょん
8362,バトル・テレポーテーション,ばとるてれぽーてーしょん
8363,コアの再練成,こあのさいれんせい
8364,鋼核の輝き,こうかくのかがやき
8365,異種闘争,いしゅとうそう
8366,海竜神の加護,かいりゅうしんのかご
8367,サイコ・ソウル,さいこそうる
8368,フレムベルカウンター,ふれむべるかうんたー
8369,身剣一体,しんけんいったい
8370,大番狂わせ,おおばんくるわせ
8371,ブラッドストーム,ぶらっどすとーむ
8372,コアキメイル・ウォーアームズ,こあきめいるうぉーあーむず
